{
  "$schema": "https://json-schema.org/draft/2020-12/schema",
  "$id": "https://sourcelens.local/schemas/aios/p1-063-offline-b0-finite-ir-result-v1.json",
  "title": "SourceLens AIOS P1-063 frozen offline B0 finite IR result",
  "type": "object",
  "additionalProperties": false,
  "required": [
    "schema_version",
    "record_type",
    "result_id",
    "adapter_id",
    "execution_mode",
    "task_id",
    "dataset_version",
    "base_commit",
    "base_tree",
    "target_id",
    "proposal"
  ],
  "properties": {
    "schema_version": { "const": 1 },
    "record_type": { "const": "sourcelens_aios_p1_063_offline_b0_finite_ir_result" },
    "result_id": { "const": "P1-063-OFFLINE-B0-IR10" },
    "adapter_id": { "const": "B0" },
    "execution_mode": { "const": "OFFLINE_FROZEN_SUBMISSION" },
    "task_id": { "const": "SL-P1-REP-001-RANGE-NORMALIZATION" },
    "dataset_version": { "const": "1.0.0" },
    "base_commit": { "const": "68ce8226eff4c5c7230b55b18a4cbea2f8e4a20f" },
    "base_tree": { "const": "900814727113d65f5dad8b63222e14f39b2cf38b" },
    "target_id": { "const": "T0" },
    "proposal": {
      "type": "object",
      "additionalProperties": false,
      "required": ["program_id", "path", "byte_length", "sha256"],
      "properties": {
        "program_id": { "const": "IR10" },
        "path": { "const": "evaluation-harness/fixtures/finite-typed-patch-ir-v1/programs/ir10.json" },
        "byte_length": { "const": 255 },
        "sha256": { "const": "ac80def7bc984820b63243b020754715c1a7ad34e18e3ded2a4ee5c1961defcc" }
      }
    }
  }
}
