{
  "schema_version": 1,
  "record_type": "sourcelens_aios_p1_063_offline_b0_finite_ir_result",
  "result_id": "P1-063-OFFLINE-B0-IR10",
  "adapter_id": "B0",
  "execution_mode": "OFFLINE_FROZEN_SUBMISSION",
  "task_id": "SL-P1-REP-001-RANGE-NORMALIZATION",
  "dataset_version": "1.0.0",
  "base_commit": "68ce8226eff4c5c7230b55b18a4cbea2f8e4a20f",
  "base_tree": "900814727113d65f5dad8b63222e14f39b2cf38b",
  "target_id": "T0",
  "proposal": {
    "program_id": "IR10",
    "path": "evaluation-harness/fixtures/finite-typed-patch-ir-v1/programs/ir10.json",
    "byte_length": 255,
    "sha256": "ac80def7bc984820b63243b020754715c1a7ad34e18e3ded2a4ee5c1961defcc"
  }
}
